### ISSUE TITLE
[Bug Report] 主路由开启dae后局域网某些IoT设备无法联网

### ISSUE THREAD

**Issue by ppdragon16** [daeuniverse/dae#858]
### Checks

- [x] I have searched the existing issues
- [x] I have read the documentation
- [ ] Is it your first time sumbitting an issue

### Current Behavior

dae运行中，家里的智能体脂秤无法使用WiFi连接。

### Expected Behavior

智能体脂秤等lot设备连接顺畅。

### Steps to Reproduce

把dae配置文件删空如下：
```
global {
    lan_interface: eth0
    wan_interface: auto
}

subscription {
}

group {
}

dns {
  upstream {
  }
  routing {
    request {
      fallback: asis
    }
    response {
      fallback: accept
    }
  }
}

routing {
    pname(dnsmasq) -> must_direct
    fallback: direct
}

```

曾经能连上wifi的体脂秤开机后无法连接wifi（wifi灯闪烁）。
`service dae stop`后，体脂秤重新开机就可以连上wifi（wifi灯常亮）。

若将`lan_interface: eth0`改为`lan_interface: eth2`（非lan口），则此问题不重现。

### Environment

- **Dae version (use `dae --version`)**:
手动编译：
dae version unstable-20250625.r817.17c7e3d
go runtime go1.23.10 linux/amd64
Copyright (c) 2022-2025 @daeuniverse
License GNU AGPLv3 <https://github.com/daeuniverse/dae/blob/main/LICENSE>

- **OS (e.g `cat /etc/os-release`)**:
NAME="ImmortalWrt"
VERSION="24.10.1"
ID="immortalwrt"
ID_LIKE="lede openwrt"
PRETTY_NAME="ImmortalWrt 24.10.1"
VERSION_ID="24.10.1"
HOME_URL="https://immortalwrt.org/"
BUG_URL="https://github.com/immortalwrt/immortalwrt/issues"
SUPPORT_URL="https://github.com/immortalwrt/immortalwrt/discussions"
BUILD_ID="r33048-cc720ea55a71"
OPENWRT_BOARD="x86/64"
OPENWRT_ARCH="x86_64"
OPENWRT_TAINTS=""
OPENWRT_DEVICE_MANUFACTURER="ImmortalWrt"
OPENWRT_DEVICE_MANUFACTURER_URL="https://immortalwrt.org/"
OPENWRT_DEVICE_PRODUCT="Generic"
OPENWRT_DEVICE_REVISION="v0"
OPENWRT_RELEASE="ImmortalWrt 24.10.1 r33048-cc720ea55a71"
OPENWRT_BUILD_DATE="1744717122"

- **Kernel (e.g. `uname -a`)**:
Linux op 6.6.86 #0 SMP Tue Apr 15 11:38:42 2025 x86_64 GNU/Linux

### Anything else?

请问如何诊断问题所在？目前不清楚是否dhcp有问题还是体脂秤采用了奇怪的方式连接它的服务器。

**Comment by MarksonHon** [comment]
@ppdragon16 怀疑是小米之类的、把一个不存在的域名强行写在Host文件里面的骚操作产品

**Comment by ppdragon16** [comment]
> [@ppdragon16](https://github.com/ppdragon16) 怀疑是小米之类的、把一个不存在的域名强行写在Host文件里面的骚操作产品

为什么这样会有问题呢？难道这个不存在的域名会在dae中重新解析（解析不到就无法连接）？

**Comment by MarksonHon** [comment]
@ppdragon16 这是几乎所有代理软件的默认行为，你可以把 dial_mode 修改成 IP 看看

**Comment by ppdragon16** [comment]
dial_mode 改成 IP 了，但是问题依旧。。。所以不是设备hosts问题？我的体脂秤是`华为智能体脂秤3 Pro`.

**Comment by MarksonHon** [comment]
@ppdragon16 用Wireshark抓包吧

**Comment by ppdragon16** [comment]
这个问题其实可以直接加上 `mac('...') -> must_direct` 解决。

然而奇怪的是 `dip(geoip:private) -> direct` 改为 `dip(geoip:private) -> must_direct` 也可以解决这个问题（但是最终配置不能这么写，会导致dae的dns配置无效）。

tcpdump 发现设备会发 IGMP 包到 238.238.238.238。
如果是 `dip(geoip:private) -> must_direct` 则tcpdump输出是这样：
```
20:48:31.453883 ARP, Request who-has ESP_0BC548.lan tell ESP_0BC548.lan, length 46
20:48:41.452864 ARP, Request who-has ESP_0BC548.lan tell ESP_0BC548.lan, length 46
20:49:20.098970 ARP, Request who-has ESP_0BC548.lan tell ESP_0BC548.lan, length 46
20:49:20.219988 IP ESP_0BC548.lan > 238.238.238.238: igmp v2 report 238.238.238.238
20:49:20.221531 ARP, Request who-has op tell ESP_0BC548.lan, length 46
20:49:20.225966 IP ESP_0BC548.lan.49153 > op.53: 0+ A? wisedevice-hilink-drcn.things.dbankcloud.cn. (61)
20:49:20.268109 IP ESP_0BC548.lan.22348 > ecs-49-4-45-21.compute.hwclouds-dns.com.5685: Flags [S], seq 6509, win 1440, options [mss 1440], length 0
20:49:20.297761 IP ESP_0BC548.lan.22348 > ecs-49-4-45-21.compute.hwclouds-dns.com.5685: Flags [.], ack 2852906045, win 1440, length 0
20:49:20.319545 IP ESP_0BC548.lan.22348 > ecs-49-4-45-21.compute.hwclouds-dns.com.5685: Flags [P.], seq 0:145, ack 1, win 1440, length 145
20:49:20.415485 IP ESP_0BC548.lan > 238.238.238.238: igmp v2 report 238.238.238.238
20:49:20.470067 IP ESP_0BC548.lan.22348 > ecs-49-4-45-21.compute.hwclouds-dns.com.5685: Flags [P.], seq 145:322, ack 91, win 1350, length 177
20:49:20.517518 IP ESP_0BC548.lan.22348 > ecs-49-4-45-21.compute.hwclouds-dns.com.5685: Flags [.], ack 355, win 1086, length 0
20:49:20.545473 IP ESP_0BC548.lan.22348 > ecs-49-4-45-21.compute.hwclouds-dns.com.5685: Flags [P.], seq 322:1196, ack 355, win 1086, length 874
20:49:20.625577 IP ESP_0BC548.lan.22348 > ecs-49-4-45-21.compute.hwclouds-dns.com.5685: Flags [.], ack 635, win 806, length 0
20:49:20.698236 IP ESP_0BC548.lan.22348 > ecs-49-4-45-21.compute.hwclouds-dns.com.5685: Flags [P.], seq 1196:1493, ack 635, win 806, length 297
20:49:20.715848 IP ESP_0BC548.lan.22348 > ecs-49-4-45-21.compute.hwclouds-dns.com.5685: Flags [P.], seq 1493:2214, ack 720, win 721, length 721
20:49:20.726759 IP ESP_0BC548.lan.22348 > ecs-49-4-45-21.compute.hwclouds-dns.com.5685: Flags [P.], seq 2214:2586, ack 805, win 636, length 372
20:49:20.727491 IP ESP_0BC548.lan.22348 > ecs-49-4-45-21.compute.hwclouds-dns.com.5685: Flags [.], ack 975, win 466, length 0
20:49:20.740151 IP ESP_0BC548.lan.22348 > ecs-49-4-45-21.compute.hwclouds-dns.com.5685: Flags [P.], seq 2586:3053, ack 1089, win 352, length 467
20:49:20.989956 IP ESP_0BC548.lan.22348 > ecs-49-4-45-21.compute.hwclouds-dns.com.5685: Flags [P.], seq 3053:4232, ack 1259, win 182, length 1179
20:49:20.998364 IP ESP_0BC548.lan.22348 > ecs-49-4-45-21.compute.hwclouds-dns.com.5685: Flags [.], ack 1259, win 903, length 0
20:49:21.030352 IP ESP_0BC548.lan.22348 > ecs-49-4-45-21.compute.hwclouds-dns.com.5685: Flags [.], ack 1979, win 183, length 0
20:49:21.038298 IP ESP_0BC548.lan.22348 > ecs-49-4-45-21.compute.hwclouds-dns.com.5685: Flags [P.], seq 4232:4679, ack 1979, win 183, length 447
20:49:21.337913 IP ESP_0BC548.lan.22348 > ecs-49-4-45-21.compute.hwclouds-dns.com.5685: Flags [.], ack 2162, win 1440, length 0
20:49:21.392343 IP ESP_0BC548.lan.5683 > 238.238.238.238.5685: UDP, length 92
20:49:21.581620 IP ESP_0BC548.lan.22348 > ecs-49-4-45-21.compute.hwclouds-dns.com.5685: Flags [.], ack 2503, win 1099, length 0
20:49:21.594261 IP ESP_0BC548.lan.22348 > ecs-49-4-45-21.compute.hwclouds-dns.com.5685: Flags [.], ack 2503, win 1099, length 0
20:49:22.392389 IP ESP_0BC548.lan.5683 > 238.238.238.238.5685: UDP, length 92
20:49:23.390191 IP ESP_0BC548.lan.5683 > 238.238.238.238.5685: UDP, length 92
20:49:23.640669 IP ESP_0BC548.lan.22348 > ecs-49-4-45-21.compute.hwclouds-dns.com.5685: Flags [P.], seq 4679:5100, ack 2503, win 1099, length 421
20:49:23.828891 IP ESP_0BC548.lan.22348 > ecs-49-4-45-21.compute.hwclouds-dns.com.5685: Flags [.], ack 2588, win 1014, length 0
20:49:24.390065 IP ESP_0BC548.lan.5683 > 238.238.238.238.5685: UDP, length 92
20:49:24.459118 ARP, Reply ESP_0BC548.lan is-at bc:ff:4d:0b:c5:48 (oui Unknown), length 46
20:49:25.414141 IP ESP_0BC548.lan.5683 > 238.238.238.238.5685: UDP, length 92
20:49:29.615302 ARP, Request who-has ESP_0BC548.lan tell ESP_0BC548.lan, length 46
```

但如果是 `dip(geoip:private) -> direct`  则tcpdump输出是这样：
```
20:52:29.363735 ARP, Request who-has ESP_0BC548.lan tell ESP_0BC548.lan, length 46
20:52:29.486392 IP ESP_0BC548.lan > 238.238.238.238: igmp v2 report 238.238.238.238
20:52:29.487945 ARP, Request who-has op tell ESP_0BC548.lan, length 46
20:52:29.526790 IP ESP_0BC548.lan.49153 > op.53: 0+ A? wisedevice-hilink-drcn.things.dbankcloud.cn. (61)
20:52:29.532239 IP ESP_0BC548.lan.49153 > op.53: 1+ A? wisedevice-hilink-drcn.things.dbankcloud.cn. (61)
20:52:29.583827 IP ESP_0BC548.lan.49153 > op.53: 0+ A? wisedevice-hilink-drcn.things.dbankcloud.cn. (61)
20:52:29.626860 IP ESP_0BC548.lan > all-systems.mcast.net: igmp v2 report all-systems.mcast.net
20:52:29.630445 IP ESP_0BC548.lan.49153 > op.53: 0+ A? wisedevice-hilink-drcn.things.dbankcloud.cn. (61)
20:52:29.680297 IP ESP_0BC548.lan.49153 > op.53: 0+ A? wisedevice-hilink-drcn.things.dbankcloud.cn. (61)
20:52:29.730147 IP ESP_0BC548.lan.49153 > op.53: 0+ A? wisedevice-hilink-drcn.things.dbankcloud.cn. (61)
20:52:29.779946 IP ESP_0BC548.lan.49153 > op.53: 0+ A? wisedevice-hilink-drcn.things.dbankcloud.cn. (61)
20:52:29.830894 IP ESP_0BC548.lan.49153 > op.53: 0+ A? wisedevice-hilink-drcn.things.dbankcloud.cn. (61)
20:52:29.884641 IP ESP_0BC548.lan.49153 > op.53: 0+ A? wisedevice-hilink-drcn.things.dbankcloud.cn. (61)
20:52:29.933633 IP ESP_0BC548.lan.49153 > op.53: 0+ A? wisedevice-hilink-drcn.things.dbankcloud.cn. (61)
20:52:29.979849 IP ESP_0BC548.lan.49153 > op.53: 0+ A? wisedevice-hilink-drcn.things.dbankcloud.cn. (61)
20:52:30.035689 IP ESP_0BC548.lan.49153 > op.53: 0+ A? wisedevice-hilink-drcn.things.dbankcloud.cn. (61)
20:52:30.079829 IP ESP_0BC548.lan.49153 > op.53: 0+ A? wisedevice-hilink-drcn.things.dbankcloud.cn. (61)
20:52:30.137874 IP ESP_0BC548.lan.49153 > op.53: 0+ A? wisedevice-hilink-drcn.things.dbankcloud.cn. (61)
20:52:30.180441 IP ESP_0BC548.lan.49153 > op.53: 0+ A? wisedevice-hilink-drcn.things.dbankcloud.cn. (61)
20:52:30.240197 IP ESP_0BC548.lan.49153 > op.53: 0+ A? wisedevice-hilink-drcn.things.dbankcloud.cn. (61)
20:52:30.279802 IP ESP_0BC548.lan.49153 > op.53: 0+ A? wisedevice-hilink-drcn.things.dbankcloud.cn. (61)
20:52:30.342324 IP ESP_0BC548.lan.49153 > op.53: 0+ A? wisedevice-hilink-drcn.things.dbankcloud.cn. (61)
20:52:30.379509 IP ESP_0BC548.lan.49153 > op.53: 0+ A? wisedevice-hilink-drcn.things.dbankcloud.cn. (61)
20:52:30.430094 IP ESP_0BC548.lan.49153 > op.53: 0+ A? wisedevice-hilink-drcn.things.dbankcloud.cn. (61)
20:52:30.480454 IP ESP_0BC548.lan.49153 > op.53: 0+ A? wisedevice-hilink-drcn.things.dbankcloud.cn. (61)
20:52:30.529823 IP ESP_0BC548.lan.49153 > op.53: 0+ A? wisedevice-hilink-drcn.things.dbankcloud.cn. (61)
20:52:30.608211 IP ESP_0BC548.lan.49153 > op.53: 0+ A? wisedevice-hilink-drcn.things.dbankcloud.cn. (61)
20:52:30.629762 IP ESP_0BC548.lan.49153 > op.53: 0+ A? wisedevice-hilink-drcn.things.dbankcloud.cn. (61)
20:52:30.681299 IP ESP_0BC548.lan.49153 > op.53: 0+ A? wisedevice-hilink-drcn.things.dbankcloud.cn. (61)
20:52:30.731796 IP ESP_0BC548.lan.49153 > op.53: 0+ A? wisedevice-hilink-drcn.things.dbankcloud.cn. (61)
20:52:30.780180 IP ESP_0BC548.lan.49153 > op.53: 0+ A? wisedevice-hilink-drcn.things.dbankcloud.cn. (61)
20:52:30.830084 IP ESP_0BC548.lan.49153 > op.53: 0+ A? wisedevice-hilink-drcn.things.dbankcloud.cn. (61)
20:52:30.880126 IP ESP_0BC548.lan.49153 > op.53: 0+ A? wisedevice-hilink-drcn.things.dbankcloud.cn. (61)
20:52:30.931530 IP ESP_0BC548.lan.49153 > op.53: 0+ A? wisedevice-hilink-drcn.things.dbankcloud.cn. (61)
20:52:30.991237 IP ESP_0BC548.lan.49153 > op.53: 0+ A? wisedevice-hilink-drcn.things.dbankcloud.cn. (61)
20:52:31.029677 IP ESP_0BC548.lan.49153 > op.53: 0+ A? wisedevice-hilink-drcn.things.dbankcloud.cn. (61)
20:52:31.085488 IP ESP_0BC548.lan.49153 > op.53: 0+ A? wisedevice-hilink-drcn.things.dbankcloud.cn. (61)
20:52:31.133628 IP ESP_0BC548.lan.49153 > op.53: 0+ A? wisedevice-hilink-drcn.things.dbankcloud.cn. (61)
20:52:31.190916 IP ESP_0BC548.lan.49153 > op.53: 0+ A? wisedevice-hilink-drcn.things.dbankcloud.cn. (61)
20:52:31.235790 IP ESP_0BC548.lan.49153 > op.53: 0+ A? wisedevice-hilink-drcn.things.dbankcloud.cn. (61)
```

用wireshark查看那些重复的dns请求都可以得到正常回复：
```
wisedevice-hilink-drcn.things.dbankcloud.cn: type A, class IN, addr 121.36.118.198
wisedevice-hilink-drcn.things.dbankcloud.cn: type A, class IN, addr 49.4.45.21
```

谁有合理的解释吗？

**Comment by ppdragon16** [comment]
一顿折腾后我现在怀疑是dae的dns劫持的问题。

当问题发生时，`wisedevice-hilink-drcn.things.dbankcloud.cn`的dns请求回复包如下：
```
Domain Name System (response)
    Transaction ID: 0x0000
    Flags: 0x8180 Standard query response, No error
        1... .... .... .... = Response: Message is a response
        .000 0... .... .... = Opcode: Standard query (0)
        .... .0.. .... .... = Authoritative: Server is not an authority for domain
        .... ..0. .... .... = Truncated: Message is not truncated
        .... ...1 .... .... = Recursion desired: Do query recursively
        .... .... 1... .... = Recursion available: Server can do recursive queries
        .... .... .0.. .... = Z: reserved (0)
        .... .... ..0. .... = Answer authenticated: Answer/authority portion was not authenticated by the server
        .... .... ...0 .... = Non-authenticated data: Unacceptable
        .... .... .... 0000 = Reply code: No error (0)
    Questions: 1
    Answer RRs: 2
    Authority RRs: 0
    Additional RRs: 0
    Queries
    Answers
        wisedevice-hilink-drcn.things.dbankcloud.cn: type A, class IN, addr 121.36.118.198
            Name: wisedevice-hilink-drcn.things.dbankcloud.cn
            Type: A (1) (Host Address)
            Class: IN (0x0001)
            Time to live: 0 (0 seconds)
            Data length: 4
            Address: 121.36.118.198
        wisedevice-hilink-drcn.things.dbankcloud.cn: type A, class IN, addr 49.4.45.21
            Name: wisedevice-hilink-drcn.things.dbankcloud.cn
            Type: A (1) (Host Address)
            Class: IN (0x0001)
            Time to live: 0 (0 seconds)
            Data length: 4
            Address: 49.4.45.21
    [Request In: 659]
    [Time: 0.004090000 seconds]

```

有两处与正常情况不一样：
 - Flags 应该为 0x8580，即 “Authoritative: Server is an authority for domain”，而不应该为“Authoritative: Server is not an authority for domain”
 - Time to live 应该为 1 seconds，而不是 “Time to live: 0 (0 seconds)”

**Comment by ppdragon16** [comment]
发现dae的dns结果（比如www.baidu.com）都是 “Flags 0x8180” 且 “Time to live: 0 (0 seconds)”。

这会不会就是root cause？

尝试在dns设置中加入ttl没啥用：
```
  fixed_domain_ttl {
    wisedevice-hilink-drcn.things.dbankcloud.cn: 2
  }
```

**Comment by MarksonHon** [comment]
@ppdragon16 https://t.me/daeuniverse

麻烦进群聊聊

**Comment by LostAttractor** [comment]
> 一顿折腾后我现在怀疑是dae的dns劫持的问题。
> 
> 当问题发生时，`wisedevice-hilink-drcn.things.dbankcloud.cn`的dns请求回复包如下：
> 
> ```
> Domain Name System (response)
>     Transaction ID: 0x0000
>     Flags: 0x8180 Standard query response, No error
>         1... .... .... .... = Response: Message is a response
>         .000 0... .... .... = Opcode: Standard query (0)
>         .... .0.. .... .... = Authoritative: Server is not an authority for domain
>         .... ..0. .... .... = Truncated: Message is not truncated
>         .... ...1 .... .... = Recursion desired: Do query recursively
>         .... .... 1... .... = Recursion available: Server can do recursive queries
>         .... .... .0.. .... = Z: reserved (0)
>         .... .... ..0. .... = Answer authenticated: Answer/authority portion was not authenticated by the server
>         .... .... ...0 .... = Non-authenticated data: Unacceptable
>         .... .... .... 0000 = Reply code: No error (0)
>     Questions: 1
>     Answer RRs: 2
>     Authority RRs: 0
>     Additional RRs: 0
>     Queries
>     Answers
>         wisedevice-hilink-drcn.things.dbankcloud.cn: type A, class IN, addr 121.36.118.198
>             Name: wisedevice-hilink-drcn.things.dbankcloud.cn
>             Type: A (1) (Host Address)
>             Class: IN (0x0001)
>             Time to live: 0 (0 seconds)
>             Data length: 4
>             Address: 121.36.118.198
>         wisedevice-hilink-drcn.things.dbankcloud.cn: type A, class IN, addr 49.4.45.21
>             Name: wisedevice-hilink-drcn.things.dbankcloud.cn
>             Type: A (1) (Host Address)
>             Class: IN (0x0001)
>             Time to live: 0 (0 seconds)
>             Data length: 4
>             Address: 49.4.45.21
>     [Request In: 659]
>     [Time: 0.004090000 seconds]
> ```
> 
> 有两处与正常情况不一样：
> 
>     * Flags 应该为 0x8580，即 “Authoritative: Server is an authority for domain”，而不应该为“Authoritative: Server is not an authority for domain”
> 
>     * Time to live 应该为 1 seconds，而不是 “Time to live: 0 (0 seconds)”

time to live是0的by design的，因为dae必须保证每个连接发送之前都尝试dns查询才能使得内核部分的domain()规则有效
我们正在尝试一种其他的方法去允许在不篡改ttl的情况下让这些事情工作，详见 #763

至于权威字段，这个是一个问题，但是不应该导致断网，你的抓包结果显示dae可以回复dns，只是部分字段略有不同？

**Comment by LostAttractor** [comment]
你的iot设备是向谁进行的DNS查询，op:53是你的局域网网关吗，为什么你的网关作为一个递归解析器会提供权威的DNS回复，这本身就是不正常的

**Comment by LostAttractor** [comment]
> Note
> 
> The following content has been translated from its original language using an automated process powered by a proprietary API. Segments originally written in English have been preserved, while non-English portions have been machine-translated for readability. Please be aware that minor inaccuracies may exist due to the automated nature of the translation.
> 
> The DNS results for dae (such as [www.baidu.com](http://www.baidu.com)) all show "Flags 0x8180" and "Time to live: 0 (0 seconds)."
> 
> Is this the root cause?
> 
> Trying to add TTL in DNS settings is not effective:
> 
> ```
>   fixed_domain_ttl {
>     wisedevice-hilink-drcn.things.dbankcloud.cn: 2
>   }
> ```

fixed_domain_ttl是强制设定dae进行内部缓存的ttl，而不是回复的ttl

**Comment by ppdragon16** [comment]
> 你的iot设备是向谁进行的DNS查询，op:53是你的局域网网关吗，为什么你的网关作为一个递归解析器会提供权威的DNS回复，这本身就是不正常的

有道理，不知道咋就抓到一个有AA标记的回复包。。。

**Comment by ppdragon16** [comment]
> [@ppdragon16](https://github.com/ppdragon16) https://t.me/daeuniverse
> 
> 麻烦进群聊聊

多年没玩电报了，账号忘了。刚尝试注册，收不到短信验证码。。。

**Comment by ppdragon16** [comment]
> time to live是0的by design的，因为dae必须保证每个连接发送之前都尝试dns查询才能使得内核部分的domain()规则有效 我们正在尝试一种其他的方法去允许在不篡改ttl的情况下让这些事情工作，详见 [#763](https://github.com/daeuniverse/dae/pull/763)
> 

IoT设备很可能就是遵从了ttl==0不断发dns请求。我稍后patch一下你的pr试试。

**Comment by LostAttractor** [comment]
> > time to live是0的by design的，因为dae必须保证每个连接发送之前都尝试dns查询才能使得内核部分的domain()规则有效 我们正在尝试一种其他的方法去允许在不篡改ttl的情况下让这些事情工作，详见 [#763](https://github.com/daeuniverse/dae/pull/763)
> 
> IoT设备很可能就是遵从了ttl==0不断发dns请求。我稍后patch一下你的pr试试。

建议使用 https://github.com/lostattractor/dae/tree/dirty 这里包含很多的修复，包括返回正确的ttl
我刚刚那个pr还没有实现返回正确的ttl

**Comment by ppdragon16** [comment]
> > > time to live是0的by design的，因为dae必须保证每个连接发送之前都尝试dns查询才能使得内核部分的domain()规则有效 我们正在尝试一种其他的方法去允许在不篡改ttl的情况下让这些事情工作，详见 [#763](https://github.com/daeuniverse/dae/pull/763)
> > 
> > 
> > IoT设备很可能就是遵从了ttl==0不断发dns请求。我稍后patch一下你的pr试试。
> 
> 建议使用 https://github.com/lostattractor/dae/tree/dirty 这里包含很多的修复，包括返回正确的ttl 我刚刚那个pr还没有实现返回正确的ttl

刚试了一下dae/tree/dirty，果然好了！

**Comment by muziling** [comment]
其实我也有这个问题，通过网线接入路由的设备，dns就会有异常，nslookup 会超时，dae服务一停nslookup 就正常。
通过wifi接入路由的设备，dns正常，用 nslookup  也正常

**Comment by BoringCat** [comment]
> 其实我也有这个问题，通过网线接入路由的设备，dns就会有异常，nslookup 会超时，dae服务一停nslookup 就正常。 通过wifi接入路由的设备，dns正常，用 nslookup 也正常

我遇到同样的超时问题，但我是请求dae本机v6 DNS超时，v4 DNS正常。并且只有在运行一段时间后才会出现问题，具体时间不确定，但三天内必定出现。怀疑是因为v6地址发生变化导致的  
超时的时候只需要重载一次配置就正常了（用的是daed，通过graphql请求重载）

试过这些请求组合
- nslookup请求dae主机fe80地址：超时
- nslookup请求dae主机公网地址：超时
- nslookup请求其他主机fe80地址：正常
- nslookup请求其他主机公网地址：正常
- nslookup请求公网DNS v6地址：超时

网络架构是旁路由，主路由提供无法关闭的DHCPv6😥，所以我需要在Win上手动配置v6 DNS地址，才能不用DHCP下来的DNS😥

**Comment by olicesx** [comment]
Closing as outdated: reported against a pre-v2.0 build/environment that has since been superseded by the v2.0.0 / #1099 datapath and control-plane rework, and no longer reproducible against current main. If this still reproduces on the latest release, please open a new issue with current-version logs. Housekeeping after #1099.

**Comment by olicesx** [comment]
Closing as outdated: reported against a pre-v2.0 build/environment that has since been superseded by the v2.0.0 / #1099 datapath and control-plane rework, and no longer reproducible against current main. If this still reproduces on the latest release, please open a new issue with current-version logs. Housekeeping after #1099.
